{
  "schema": "zaentrum.library.source/1",
  "id": "c8c91e05-b8ad-5e9e-bb3d-003a6d8c90cb",
  "rev": 1,
  "createdAt": "2026-09-13T12:00:00Z",
  "createdBy": "example",
  "updatedAt": "2026-09-13T12:00:00Z",
  "updatedBy": "example",
  "versionId": "f13cfb12-e69b-588c-b10b-a99785850f44",
  "workId": "0f3cd3cc-270c-511b-8650-c1a9710156ce",
  "file": {
    "path": "source/tears_of_steel_4k.mkv",
    "name": "tears_of_steel_4k.mkv",
    "kind": "stream-container",
    "sizeBytes": 6743020000,
    "mtime": "2026-09-13T12:00:00Z",
    "fixity": {
      "qh1": "sha256:0000000000000000000000000000000000000000000000000000000000000000"
    },
    "origin": {
      "libraryPath": "movies/Tears of Steel (2012)/tears_of_steel_4k.mkv",
      "folder": "Tears of Steel (2012)",
      "migratedAt": "2026-09-13T12:00:00Z",
      "method": "hardlink"
    }
  },
  "labels": {
    "quality": null,
    "releaseSource": "unknown",
    "resolution": null,
    "proper": false,
    "revision": null,
    "edition": null,
    "folderEdition": null
  },
  "container": {
    "format": "matroska,webm",
    "durationMs": 734000,
    "bitrate": 73500000,
    "title": "Tears of Steel",
    "muxingApp": "libebml v1.4.4 + libmatroska v1.7.1",
    "writingApp": null,
    "creationTime": null,
    "tags": {}
  },
  "fidelity": {
    "class": "original",
    "evidence": [
      {
        "signal": "encoder-tag",
        "value": "libebml v1.4.4 + libmatroska v1.7.1",
        "weight": 0.5
      }
    ]
  },
  "streams": [
    {
      "index": 0,
      "type": "video",
      "codec": "hevc",
      "language": null,
      "languageRaw": null,
      "title": null,
      "dispositions": {
        "default": true
      },
      "profile": "Main 10",
      "level": 153,
      "bitDepth": 10,
      "pixelFormat": "yuv420p10le",
      "width": 3840,
      "height": 1600,
      "sampleAspectRatio": "1:1",
      "displayAspectRatio": "12:5",
      "frameRate": "24/1",
      "fieldOrder": "progressive",
      "bitrate": null,
      "colour": {
        "primaries": "bt2020",
        "transfer": "smpte2084",
        "matrix": "bt2020nc",
        "range": "tv"
      },
      "hdr": {
        "format": "hdr10",
        "masteringDisplay": null,
        "contentLightLevel": null,
        "dolbyVision": null
      },
      "stereo3d": null,
      "encoder": null
    },
    {
      "index": 1,
      "type": "audio",
      "codec": "flac",
      "language": "en",
      "languageRaw": "eng",
      "title": "Surround 5.1",
      "dispositions": {
        "default": true
      },
      "profile": null,
      "channels": 6,
      "channelLayout": "5.1(side)",
      "sampleRate": 48000,
      "bitDepth": 24,
      "bitrate": null,
      "lossless": true,
      "objectAudio": "none",
      "titleClaim": {
        "codec": null,
        "channels": "5.1",
        "contradictsActual": false
      },
      "encoder": null
    },
    {
      "index": 2,
      "type": "subtitle",
      "codec": "subrip",
      "language": "de",
      "languageRaw": "ger",
      "title": "Deutsch",
      "dispositions": {
        "default": false,
        "forced": false
      },
      "form": "text",
      "styled": false,
      "variant": null
    }
  ],
  "chapters": [
    {
      "startMs": 0,
      "endMs": 60000,
      "title": "Oude Kerk"
    }
  ],
  "segments": [
    {
      "kind": "credits",
      "startMs": 640000,
      "endMs": 734000,
      "detector": "blackframe",
      "confidence": 0.9,
      "label": null
    }
  ],
  "sidecars": [],
  "subtitleDecisions": {
    "defaultStreamIndex": null,
    "decidedBy": null
  },
  "probe": {
    "tool": "ffprobe",
    "version": null,
    "at": "2026-09-13T12:00:00Z",
    "raw": null,
    "note": "example fixture: raw probe omitted"
  }
}
