{
  "schema": "zaentrum.library.source/1",
  "id": "66b4ed7c-c0a1-5b3e-8115-f9c17e50ee38",
  "rev": 1,
  "createdAt": "2026-09-13T12:00:00Z",
  "createdBy": "example",
  "updatedAt": "2026-09-13T12:00:00Z",
  "updatedBy": "example",
  "versionId": "77e20715-4638-5860-909a-d1782da1bb36",
  "workId": "c389fac4-32a4-5492-b8d7-17ea7c298f6b",
  "file": {
    "path": "source/Example Show - S01E01-E02 - Pilot.mkv",
    "name": "Example Show - S01E01-E02 - Pilot.mkv",
    "kind": "stream-container",
    "sizeBytes": 2000000000,
    "fixity": {
      "qh1": "sha256:2222222222222222222222222222222222222222222222222222222222222222"
    }
  },
  "labels": {
    "quality": "WEBDL-2160p",
    "releaseSource": "webdl",
    "resolution": "2160p",
    "proper": false,
    "revision": null,
    "edition": null,
    "folderEdition": null
  },
  "container": {
    "format": "matroska,webm",
    "durationMs": 5400000
  },
  "fidelity": {
    "class": "unknown",
    "evidence": []
  },
  "streams": [
    {
      "index": 0,
      "type": "audio",
      "codec": "eac3",
      "language": "en",
      "languageRaw": "eng",
      "title": null,
      "dispositions": {
        "default": true
      },
      "profile": "Dolby Digital Plus + Dolby Atmos",
      "channels": 6,
      "channelLayout": "5.1(side)",
      "sampleRate": 48000,
      "bitDepth": null,
      "bitrate": 576000,
      "lossless": false,
      "objectAudio": "atmos",
      "titleClaim": null,
      "encoder": null
    }
  ],
  "sidecars": [
    {
      "file": "sidecars/Example Show - S01E01-E02 - Pilot.en.sdh.srt",
      "originalName": "Example Show - S01E01-E02 - Pilot.en.sdh.srt",
      "kind": "subtitle",
      "format": "srt",
      "language": "en",
      "forced": false,
      "hearingImpaired": true,
      "sizeBytes": 40000,
      "fixity": {
        "qh1": "sha256:3333333333333333333333333333333333333333333333333333333333333333"
      }
    }
  ]
}
